{
  "phase": {
    "id": "done",
    "startedAt": 1005,
    "deadline": null
  },
  "rng": {
    "seed": 103,
    "step": 18
  },
  "players": {
    "p0": {
      "id": "p0",
      "name": "Player 1",
      "avatarId": "0",
      "connected": true,
      "bot": true
    },
    "p1": {
      "id": "p1",
      "name": "Player 2",
      "avatarId": "1",
      "connected": true,
      "bot": true
    },
    "p2": {
      "id": "p2",
      "name": "Player 3",
      "avatarId": "2",
      "connected": true,
      "bot": true
    },
    "p3": {
      "id": "p3",
      "name": "Player 4",
      "avatarId": "3",
      "connected": true,
      "bot": true
    }
  },
  "settings": {
    "rounds": 1,
    "turnSeconds": 45,
    "difficulty": 4,
    "allowFlip": false
  },
  "order": [
    "p0",
    "p1",
    "p2",
    "p3"
  ],
  "left": [],
  "round": 1,
  "seat": 3,
  "level": {
    "width": 5,
    "height": 4,
    "cells": [
      [
        0,
        0
      ],
      [
        1,
        0
      ],
      [
        3,
        0
      ],
      [
        0,
        1
      ],
      [
        1,
        1
      ],
      [
        3,
        1
      ],
      [
        0,
        2
      ],
      [
        1,
        2
      ],
      [
        2,
        2
      ],
      [
        3,
        2
      ],
      [
        3,
        3
      ],
      [
        4,
        3
      ]
    ],
    "difficulty": 4,
    "allowFlip": false,
    "crates": [
      {
        "id": "crate-1",
        "cells": [
          [
            0,
            0
          ],
          [
            1,
            0
          ],
          [
            1,
            1
          ],
          [
            2,
            1
          ]
        ],
        "value": 120
      },
      {
        "id": "crate-2",
        "cells": [
          [
            0,
            0
          ],
          [
            1,
            0
          ],
          [
            1,
            1
          ]
        ],
        "value": 40
      },
      {
        "id": "crate-6",
        "cells": [
          [
            0,
            0
          ],
          [
            1,
            0
          ],
          [
            2,
            0
          ]
        ],
        "value": 1
      },
      {
        "id": "crate-5",
        "cells": [
          [
            0,
            0
          ],
          [
            1,
            0
          ]
        ],
        "value": 1
      },
      {
        "id": "crate-7",
        "cells": [
          [
            0,
            0
          ],
          [
            1,
            0
          ],
          [
            1,
            1
          ]
        ],
        "value": 1
      },
      {
        "id": "crate-4",
        "cells": [
          [
            0,
            0
          ],
          [
            1,
            0
          ],
          [
            0,
            1
          ]
        ],
        "value": 10
      },
      {
        "id": "crate-3",
        "cells": [
          [
            0,
            0
          ],
          [
            1,
            0
          ]
        ],
        "value": 30
      }
    ]
  },
  "optimum": 200,
  "solution": [
    {
      "crateId": "crate-1",
      "x": 2,
      "y": 2,
      "rotation": 0
    },
    {
      "crateId": "crate-2",
      "x": 0,
      "y": 0,
      "rotation": 0
    },
    {
      "crateId": "crate-3",
      "x": 3,
      "y": 0,
      "rotation": 1
    },
    {
      "crateId": "crate-4",
      "x": 0,
      "y": 1,
      "rotation": 3
    }
  ],
  "layouts": {
    "p0": [
      {
        "crateId": "crate-1",
        "x": 2,
        "y": 2,
        "rotation": 0
      }
    ],
    "p1": [
      {
        "crateId": "crate-2",
        "x": 0,
        "y": 0,
        "rotation": 0
      },
      {
        "crateId": "crate-1",
        "x": 2,
        "y": 2,
        "rotation": 0
      }
    ],
    "p2": [
      {
        "crateId": "crate-1",
        "x": 2,
        "y": 2,
        "rotation": 0
      },
      {
        "crateId": "crate-3",
        "x": 3,
        "y": 0,
        "rotation": 1
      },
      {
        "crateId": "crate-2",
        "x": 0,
        "y": 0,
        "rotation": 0
      }
    ],
    "p3": [
      {
        "crateId": "crate-4",
        "x": 0,
        "y": 1,
        "rotation": 3
      },
      {
        "crateId": "crate-3",
        "x": 3,
        "y": 0,
        "rotation": 1
      },
      {
        "crateId": "crate-1",
        "x": 2,
        "y": 2,
        "rotation": 0
      }
    ]
  },
  "submitted": [
    "p0",
    "p1",
    "p2",
    "p3"
  ],
  "scores": {
    "p0": 0.6,
    "p1": 0.8,
    "p2": 0.95,
    "p3": 0.8
  },
  "history": {
    "p0": [
      {
        "value": 120,
        "optimum": 200,
        "ratio": 0.6
      }
    ],
    "p1": [
      {
        "value": 160,
        "optimum": 200,
        "ratio": 0.8
      }
    ],
    "p2": [
      {
        "value": 190,
        "optimum": 200,
        "ratio": 0.95
      }
    ],
    "p3": [
      {
        "value": 160,
        "optimum": 200,
        "ratio": 0.8
      }
    ]
  },
  "seenHolds": [
    "0,0;1,0;3,0;0,1;1,1;3,1;0,2;1,2;2,2;3,2;3,3;4,3"
  ]
}
